nid,id,hd,cr,wc,pd,et,sn,sc,ed,pg,la,cy,lp,td,ct,rf,co,ina,ns,re,ipc,ipd,pub,an
358,Factiva-20210602-1533,"CDC Says It's Time To Relax Guidance On Masks --- Social distancing no longer urged in most cases for those who are fully vaccinated
   BY
By Brianna Abbott",,992 words,14 May 2021,,The Wall Street Journal,J,,A1,English,"Copyright 2021 Dow Jones & Company, Inc. All Rights Reserved.","Fully vaccinated people don't need to wear a mask or physically distance during outdoor or indoor activities, large or small, federal health officials said, the broadest easing of pandemic recommendations so far.

The fully vaccinated should continue to wear a mask while traveling by plane, bus or train, and the guidance doesn't apply to certain places like hospitals, nursing homes and prisons, the federal Centers for Disease Control and Prevention said Thursday.",,,,hwmlcb : BioNTech SE | mdrthu : Moderna Inc | pfiz : Pfizer Inc | uscdcp : Centers for Disease Control and Prevention,i2569 : Biotechnology | i257 : Pharmaceuticals | i951 : Healthcare/Life Sciences | ibioph : Biopharmaceuticals,gvbod : Government Bodies | ghea : Health | gimmu : Immunizations | nmajev : Major News Events | npag : Page One Stories | ntop : Top Wire News | gcat : Political/General News | gpir : Politics/International Relations | gpol : Domestic Politics | gtrea : Medical Treatments/Procedures | ncat : Content Types | ndj : Dow Jones Top Stories | redit : Selection of Top Stories/Trends/Analysis,usa : United States | israel : Israel | usdc : Washington DC | asiaz : Asia | meastz : Middle East | medz : Mediterranean | namz : North America | uss : Southern U.S. | wasiaz : Western Asia,MEN | EXE | HHS | USG | NND | PGO,,"Dow Jones & Company, Inc.",Document J000000020210514eh5e0001z
359,Factiva-20210602-1533,"Can we start talking about the end of the pandemic? Sure, but . . .
   BY
Joel Achenbach",,"1,774 words",14 May 2021,,The Washington Post,WP,FINAL,A01,English,"Copyright 2021, The Washington Post Co. All Rights Reserved","For more than a year, everyone has wondered when this dreadful pandemic will end. The answer has always been ""not for a long time."" That answer, however, has been overtaken by events - at least in the United States.

The end of the pandemic may not be near, exactly, but it's no longer rash, impolitic or scientifically dubious to broach the topic.",,,,,,gsars : Novel Coronaviruses | gout : Outbreaks/Epidemics | gglobe : Global/World Issues | npag : Page One Stories | gcat : Political/General News | gcold : Respiratory Tract Diseases | ghea : Health | gmed : Medical Conditions | gspox : Infectious Diseases | ncat : Content Types,usa : United States | namz : North America,,Health-Environment-Science,Washington Post,Document WP00000020210514eh5e0000a
360,Factiva-20210602-1533,"My Mask, My Safety Signal, My Social Contract
   BY
By Glynnis MacNicol",,"1,220 words",13 May 2021,,The New York Times,NYTF,Late Edition - Final,3,English,Copyright 2021 The New York Times Company.  All Rights Reserved.,"Just because the fully vaccinated can remove their masks outdoors doesn't mean they're ready to let go of them fully.

Walking around New York City these days, one might not guess that it's been a little over two weeks since the Centers for Disease Control and Prevention announced more relaxed mask guidelines, which state that fully vaccinated people can remove their face coverings when outside.",,,,,,glife : Living/Lifestyle | gcat : Political/General News,usny : New York State | nyc : New York City | namz : North America | usa : United States | use : Northeast U.S.,,Style Desk,The New York Times Company,Document NYTF000020210513eh5d0003a
361,Factiva-20210602-1533,"C.D.C. Chief Defends Advice on Control Measures
   BY
By Noah Weiland",,"1,281 words",12 May 2021,,The New York Times,NYTF,Late Edition - Final,4,English,Copyright 2021 The New York Times Company.  All Rights Reserved.,"At a Senate hearing on the federal government's pandemic response, Republicans criticized the government's guidance for cruise ships, fishermen, summer camps and outdoor mask wearing.

WASHINGTON -- The director of the Centers for Disease Control and Prevention on Tuesday defended the agency against accusations that federal scientists were being too slow to update their pandemic-control guidance and overly conservative with their recommendations, especially on outdoor mask wearing.",,,,,,gvbod : Government Bodies | gsars : Novel Coronaviruses | gout : Outbreaks/Epidemics | gcrui : Cruises | gcat : Political/General News | gcold : Respiratory Tract Diseases | ghea : Health | glife : Living/Lifestyle | gmed : Medical Conditions | gpir : Politics/International Relations | gpol : Domestic Politics | gspox : Infectious Diseases | gtour : Travel,usdc : Washington DC | namz : North America | usa : United States | uss : Southern U.S.,,Foreign Desk,The New York Times Company,Document NYTF000020210512eh5c00043
362,Factiva-20210602-1533,"U.S. News: Children Under 12 Could Get Covid Shots by Late Fall
   BY
By Thomas M. Burton",,493 words,12 May 2021,,The Wall Street Journal,J,,A5,English,"Copyright 2021 Dow Jones & Company, Inc. All Rights Reserved.","WASHINGTON -- There will likely be enough evidence by late fall this year to potentially extend the use of Covid-19 vaccines to many children under age 12, Biden administration health officials told a U.S. Senate panel Tuesday.

""We expect to have data on the safety and effectiveness of vaccines for children under 12"" by that time, David Kessler, the administration's chief Covid-19 scientific officer, told the Senate Committee on Health, Education, Labor and Pensions.",,,,hwmlcb : BioNTech SE | pfiz : Pfizer Inc | usasnt : United States Senate,i2572 : Vaccines | i2569 : Biotechnology | i257 : Pharmaceuticals | i951 : Healthcare/Life Sciences | idrugty : Specialized Drugs/Medications | ibioph : Biopharmaceuticals,gihea : Infant/Child/Teenage Health | gimmu : Immunizations | gout : Outbreaks/Epidemics | gsars : Novel Coronaviruses | gvuph : Upper House | gpol : Domestic Politics | gvcng : Legislative Branch | neqac : Equities Asset Class News | nmajev : Major News Events | ntop : Top Wire News | c23 : Research/Development | ccat : Corporate/Industrial News | gcat : Political/General News | gcold : Respiratory Tract Diseases | ggroup : Demographic Health | ghea : Health | gmed : Medical Conditions | gpir : Politics/International Relations | gspox : Infectious Diseases | gtrea : Medical Treatments/Procedures | gvbod : Government Bodies | ncat : Content Types | ndj : Dow Jones Top Stories | nfact : Factiva Filters | redit : Selection of Top Stories/Trends/Analysis,usa : United States | india : India | asiaz : Asia | bric : BRICS Countries | devgcoz : Emerging Market Countries | dvpcoz : Developing Economies | indsubz : Indian Subcontinent | namz : North America | sasiaz : Southern Asia,ABO | AEQI | SGN | CNG | HHS | USG | HCR | NND | USN,,"Dow Jones & Company, Inc.",Document J000000020210512eh5c0000y
363,Factiva-20210602-1533,"COVID-19 measures flatten flu curve
   BY
Adrianna Rodriguez",,634 words,11 May 2021,,USA Today,USAT,,"D.1
   VOL
ISSN:07347456",English,©021 USA Today.  Provided by ProQuest Information and Learning.   All Rights Reserved.,"A year full of social distancing, mask wearing, hand washing and staying at home to prevent coronavirus spread rendered the 2020-2021 influenza season practically nonexistent.

Public health and clinical laboratories reported 2,038 flu cases during the season from Sept. 27, 2020, to April 24, 2021, according to the Centers for Disease Control and Prevention. The agency estimated about 38 million people were sick with the flu during the 2019-2020 season.",,,,,i2572 : Vaccines | i257 : Pharmaceuticals | i951 : Healthcare/Life Sciences | idrugty : Specialized Drugs/Medications,gcold : Respiratory Tract Diseases | gsars : Novel Coronaviruses | gout : Outbreaks/Epidemics | ghea : Health | gmed : Medical Conditions | npag : Page One Stories | reqrph : Suggested Reading   Pharmaceuticals | gcat : Political/General News | gspox : Infectious Diseases | ncat : Content Types | redit : Selection of Top Stories/Trends/Analysis | reqr : Suggested Reading   Industry News,usa : United States | namz : North America,,"Newspapers | USA Today, a division of Gannett Satellite Information Network, Inc. | News",USA Today Information Network,Document USAT000020210511eh5b0000v
364,Factiva-20210602-1533,"Pack patience on your flight this summer
   BY
Melissa Yeager",,911 words,11 May 2021,,USA Today,USAT,,"B.4
   VOL
ISSN:07347456",English,©021 USA Today.  Provided by ProQuest Information and Learning.   All Rights Reserved.,"Fully vaccinated, Paul Feldman said he felt safe as he walked onto his American Airlines flight on Feb. 22 in Florida prepared to accompany a friend to a funeral.

Feldman, 71, never imagined he'd hobble off the plane at his layover in North Carolina with a torn ACL and medial meniscus tear caused, he said, when another passenger pushed him as he was trying to exit the aircraft.",,,,amairl : American Airlines Inc | amair : American Airlines Group Inc.,i764 : Airports | i3640010 : Civil Aircraft | i75 : Airlines | iaer : Aerospace/Defense | i364 : Aerospace Products/Parts | iairtr : Air Transport | iindstrls : Industrial Goods | itsp : Transportation/Logistics | i7501 : Passenger Airlines,c13 : Regulation/Government Policy | ccat : Corporate/Industrial News | gstres : Stress-related Conditions | reqrad : Suggested Reading   Aerospace/Defense | reqrai : Suggested Reading   Airlines | gcat : Political/General News | ghea : Health | gmed : Medical Conditions | ncat : Content Types | nfact : Factiva Filters | nfcpin : C&E Industry News Filter | redit : Selection of Top Stories/Trends/Analysis | reqr : Suggested Reading   Industry News,usnc : North Carolina | namz : North America | usa : United States | uss : Southern U.S.,,"Newspapers | USA Today, a division of Gannett Satellite Information Network, Inc. | News",USA Today Information Network,Document USAT000020210511eh5b00005
365,Factiva-20210602-1533,"CDC lists safety guidelines for restarting US cruises
   BY
Fran Golden; CruiseCriticcom",,463 words,10 May 2021,,USA Today,USAT,,"D.4
   VOL
ISSN:07347456",English,©021 USA Today.  Provided by ProQuest Information and Learning.   All Rights Reserved.,"The U.S. Centers for Disease Control and Prevention has updated its Operations Manual for cruise ship operators, setting a series of rules such as mask wearing, social distancing and a restriction on independent shore experiences.

It's the guidance that the cruise industry has been waiting on for months, and it won't make everyone happy. The rules are part of the Conditional Sail Order to allow cruising to resume in the U.S. and will be in effect through October.",,,,uscdcp : Centers for Disease Control and Prevention,,gcrui : Cruises | glife : Living/Lifestyle | gmed : Medical Conditions | gcat : Political/General News | ghea : Health | gtour : Travel,usa : United States | namz : North America,,"Newspapers | USA Today, a division of Gannett Satellite Information Network, Inc. | News",USA Today Information Network,Document USAT000020210510eh5a0000g
366,Factiva-20210602-1533,HIGHLIGHT: New York,,"2,288 words",10 May 2021,,USA Today,USAT,,"D.5
   VOL
ISSN:07347456",English,©021 USA Today.  Provided by ProQuest Information and Learning.   All Rights Reserved.,"Alabama Tuscaloosa: Alabama football coach Nick Saban, former NBA star Charles Barkley and other sports figures have taped a public service announcement encouraging residents to get COVID-19 shots, saying that's the way to ensure stadiums are filled and ""loud again"" this fall.

Alaska Anchorage: A coronavirus outbreak at an April high school wrestling tournament has been linked to more than 20 infections in five communities, health officials say.",,,,,i2572 : Vaccines | i257 : Pharmaceuticals | i951 : Health Care/Life Sciences | idrugty : Specialized Drugs/Medications,gsars : Novel Coronaviruses | gout : Outbreaks/Epidemics | gimmu : Immunizations | reqrhc : Suggested Reading   Health Care | reqrph : Suggested Reading   Pharmaceuticals | gcat : Political/General News | gcold : Respiratory Tract Diseases | ghea : Health | gmed : Medical Conditions | gspox : Infectious Diseases | gtrea : Medical Treatments/Procedures | redit : Selection of Top Stories/Trends/Analysis | reqr : Suggested Reading   Industry News,usa : United States | usaz : Arizona | usak : Alaska | usal : Alabama | usfl : Florida | usms : Mississippi | usnj : New Jersey | usny : New York State | usok : Oklahoma | namz : North America | use : Northeast U.S. | uss : Southern U.S. | usw : Western U.S.,,"Newspapers | USA Today, a division of Gannett Satellite Information Network, Inc. | News",USA Today Information Network,Document USAT000020210510eh5a00001
367,Factiva-20210602-1533,NHL relaxes protocols for playoff teams that are 85% vaccinated: PRO HOCKEY,Staff,130 words,9 May 2021,,The Atlanta Journal - Constitution,ATJC,Main,C6,English,"Copyright (c) 2021 The Atlanta Journal-Constitution, All Rights Reserved","The NHL is relaxing virus protocols during the playoffs for teams that reach a threshold for vaccination. The league sent a memo to teams and players outlining changes that take hold once 85% or more of the traveling party has been fully vaccinated.

The changes include loosened restrictions on indoor and outdoor dining, testing frequency and mask-wearing and quarantine requirements. The league had maintained strict COVID-19 rules since the start of the season and added more protections in February when cases were increasing. The NHL is the last of the major four North American sports leagues to announce plans to relax virus protocols for teams based on vaccination levels.&",,,,,,giceh : Ice Hockey | gspo : Sports | gimmu : Immunizations | gsars : Novel Coronaviruses | gcat : Political/General News | gcold : Respiratory Tract Diseases | ghea : Health | gmed : Medical Conditions | gspox : Infectious Diseases | gtrea : Medical Treatments/Procedures | gwint : Winter Sports | ncat : Content Types | nfact : Factiva Filters | nfce : C&E Exclusion Filter | nrgn : Routine General News,usga : Georgia (US) | namz : North America | usa : United States | uss : Southern U.S.,,pagesuite,"Cox Enterprises, Inc., d/b/a The Atlanta Journal-Constitution",Document ATJC000020210509eh59000gv
368,Factiva-20210602-1533,"Get Yourself Ready For Dating's New World
   BY
By Sara Aridi",,"1,547 words",9 May 2021,,The New York Times,NYTF,Late Edition - Final,8,English,Copyright 2021 The New York Times Company.  All Rights Reserved.,"Boundaries. Meaningful connections. ''Covid baggage.'' Here's what dating will look like in a post-pandemic world.

Eons ago, romance often involved dinner and a movie, a few drinks in a crowded bar or a goodnight kiss -- intimate experiences the pandemic abruptly replaced with social distancing, mask-wearing and the threat of catching a deadly disease.",,,,,,glife : Living/Lifestyle | gmovie : Movies | gcat : Political/General News | gent : Arts/Entertainment,nyc : New York City | namz : North America | usa : United States | use : Northeast U.S. | usny : New York State,,House & Home/Style Desk,The New York Times Company,Document NYTF000020210509eh590004m
369,Factiva-20210602-1533,"Carter scores lone goal as Pittsburgh clinches first in the East
   BY
Associated Press",,944 words,9 May 2021,,The Washington Post,WP,FINAL,D05,English,"Copyright 2021, The Washington Post Co. All Rights Reserved","Jeff Carter scored and Maxime Lagace stopped 29 shots for his first career shutout as the Pittsburgh Penguins beat the visiting Buffalo Sabres, 1-0, on Saturday.

Lagace, making his first start in more than two years, got his seventh career win and helped Pittsburgh clinch first place in the East Division. The Penguins were without Tristan Jarry and Casey DeSmith, their top two goaltenders, for the regular season finale.",,,,ppgins : Pittsburgh Penguins (team) | vggkgh : Vegas Golden Knights (team) | bffsbs : Buffalo Sabres (team),,giceh : Ice Hockey | gspo : Sports | gwint : Winter Sports | ncat : Content Types | nfact : Factiva Filters | nfce : C&E Exclusion Filter | nrgn : Routine General News,usa : United States | use : Northeast U.S. | usfl : Florida | uspa : Pennsylvania | namz : North America | uss : Southern U.S.,,Sports,Washington Post,Document WP00000020210509eh5900041
370,Factiva-20210602-1533,"Nick Saban Makes Vaccine Push --- Alabama has called on the state's leading influencer to offer a powerful incentive: full stadiums
   BY
By Louise Radnofsky and Ben Cohen",,"1,254 words",8 May 2021,,The Wall Street Journal,J,,A14,English,"Copyright 2021 Dow Jones & Company, Inc. All Rights Reserved.","With a Covid-19 vaccination rate that ranks among the lowest in the country, Alabama is enlisting someone with experience leading the state to the top of the national rankings: Crimson Tide football coach Nick Saban.

Saban taped a public service announcement this week for the Alabama Department of Public Health urging Alabamians to get vaccinated, the state says. His endorsement comes as demand for the shot lags far behind supply in the state and the federal government is threatening to reallocate doses to places where residents want them more.",,,,aldphe : Alabama Department of Public Health,,gspo : Sports | gamer : American Football | ghea : Health | gimmu : Immunizations | nmajev : Major News Events | ntop : Top Wire News | gsars : Novel Coronaviruses | reqrhc : Suggested Reading   Health Care | gcat : Political/General News | gcold : Respiratory Tract Diseases | gmed : Medical Conditions | gspox : Infectious Diseases | gtrea : Medical Treatments/Procedures | ncat : Content Types | ndj : Dow Jones Top Stories | nfact : Factiva Filters | nfce : C&E Exclusion Filter | nrgn : Routine General News | redit : Selection of Top Stories/Trends/Analysis | reqr : Suggested Reading   Industry News,usal : Alabama | uss : Southern U.S. | usa : United States | namz : North America,NND | SPO,,"Dow Jones & Company, Inc.",Document J000000020210508eh580001u
371,Factiva-20210602-1533,"Pattern of Neglect and Secrecy by ICE Helped Fuel Outbreaks
   BY
By Isabelle Niu and Emily Rhyne",,"1,192 words",8 May 2021,,The New York Times,NYTF,Late Edition - Final,8,English,Copyright 2021 The New York Times Company.  All Rights Reserved.,"The Times found a pattern of neglect and secrecy that helped fuel outbreaks both inside and outside ICE detention facilities.

The United States currently has the largest immigration detention system in the world. On any given day, Immigration and Customs Enforcement, or ICE, holds tens of thousands of people in about 200 facilities across the country. And throughout the pandemic, these facilities have become some of the most dangerous places in the United States when it comes to Covid-19 outbreaks.",,,,usice : United States Immigration and Customs Enforcement,,gout : Outbreaks/Epidemics | gsars : Novel Coronaviruses | gpris : Prisons/Prisoners | gimm : Human Migration | gcat : Political/General News | gcns : National/Public Security | gcold : Respiratory Tract Diseases | ghea : Health | ghome : Law Enforcement | gmed : Medical Conditions | gpir : Politics/International Relations | gspox : Infectious Diseases,usa : United States | ustx : Texas | uss : Southern U.S. | namz : North America,,Foreign Desk,The New York Times Company,Document NYTF000020210508eh580004z
372,Factiva-20210602-1533,"Greece, Heavily Reliant on Tourism Money, Gambles on Early Reopening
   BY
By Paige McClanahan",,"1,867 words",8 May 2021,,The New York Times,NYTF,Late Edition - Final,5,English,Copyright 2021 The New York Times Company.  All Rights Reserved.,"In easing its restrictions, the country, largely dependent on tourist dollars, has jumped ahead of a broader European Union plan to welcome visitors from outside the bloc.

Greece has reopened to many overseas visitors, including from the United States, jumping ahead of most of its European neighbors in restarting tourism, even as the country's hospitals remain full and more than three-quarters of Greeks are still unvaccinated.",,,,euruno : European Union,,gtour : Travel | gcat : Political/General News | glife : Living/Lifestyle,greece : Greece | eurz : Europe | usa : United States | balkz : Balkan States | devgcoz : Emerging Market Countries | eecz : European Union Countries | medz : Mediterranean | namz : North America,,Business/Financial Desk,The New York Times Company,Document NYTF000020210508eh580002w
373,Factiva-20210602-1533,Jousting Joshes generate joy,,156 words,8 May 2021,,The Washington Post,WP,FINAL,A17,English,"Copyright 2021, The Washington Post Co. All Rights Reserved","What a delight to read the April 29 Style article ""He was just Joshing. Then hundreds converged for a pool-noodle duel."" I grinned until my cheeks hurt and felt a buoyancy in my spirit as I read the refreshing, wholesome story of young people with imagination, spirit and heart: All those joshing Joshes raised money for a children's hospital, donated food to a food bank, encouraged mask-wearing and ruled out violence in the Josh Battle Royale.

Equally heartening was the outcome of the battle. The winner, acclaimed by all and hoisted into the air, was 4-year-old Joshua Vinson Jr., ""Little Josh."" It attests to the basically nice and generous character of Little Josh's opponents, who most likely pulled their punches a bit in their pool-noodle duel with the young champ.",,,,,,nedi : Editorials | ncat : Content Types,usa : United States | namz : North America,,Editorial-Opinion,Washington Post,Document WP00000020210508eh580001o
374,Factiva-20210602-1533,"Covid Data Shows U.S. Is 'Turning the Corner,' Fueling a Sense of Hope
   BY
By Julie Bosman and Sarah Mervosh",,"1,840 words",6 May 2021,,The New York Times,NYTF,Late Edition - Final,1,English,Copyright 2021 The New York Times Company.  All Rights Reserved.,"Cases and deaths have dipped, and vaccinations make scientists hopeful, even as variants mean the coronavirus is here to stay.

After weeks of coronavirus patients flooding emergency rooms in Michigan, the worst Covid-19 hot spot in the nation, hospitalizations are finally falling.",,,,,,gout : Outbreaks/Epidemics | gsars : Novel Coronaviruses | npag : Page One Stories | gcat : Political/General News | gcold : Respiratory Tract Diseases | ghea : Health | gmed : Medical Conditions | gspox : Infectious Diseases | ncat : Content Types,usa : United States | nyc : New York City | namz : North America | use : Northeast U.S. | usny : New York State,,Foreign Desk,The New York Times Company,Document NYTF000020210506eh5600059
375,Factiva-20210602-1533,"Looking to Get Americans Vaccinated? Offer a Cash Reward.
   BY
By Lynn Vavreck",,"1,352 words",5 May 2021,,The New York Times,NYTF,Late Edition - Final,4,English,Copyright 2021 The New York Times Company.  All Rights Reserved.,"A cash reward works best with Democrats, and relaxing safety guidelines seems to motivate Republicans, a survey study shows.

What's the best way to persuade the millions of Americans who are still unvaccinated against Covid-19 to get their shots?",,,,,,gimmu : Immunizations | gpol : Domestic Politics | gsars : Novel Coronaviruses | nsur : Surveys/Polls | gcat : Political/General News | gcold : Respiratory Tract Diseases | ghea : Health | gmed : Medical Conditions | gpir : Politics/International Relations | gspox : Infectious Diseases | gtrea : Medical Treatments/Procedures | ncat : Content Types,usa : United States | namz : North America,,Business/Financial Desk,The New York Times Company,Document NYTF000020210505eh550004o
376,Factiva-20210602-1533,"Coronavirus Update
   BY
By James Barron",,"1,045 words",5 May 2021,,The New York Times,NYTF,Late Edition - Final,4,English,Copyright 2021 The New York Times Company.  All Rights Reserved.,"President Biden set another goal for vaccinations: to inoculate 70 percent of American adults at least partially by the Independence Day holiday.

That is about 15 million more adults than have already received a shot, and the president acknowledged that it might not be easy. The demand for vaccinations has fallen in the last couple of weeks, to a seven-day average of 2.2 million doses a day. For much of April, the average was above 3 million a day.",,,,,,gsars : Novel Coronaviruses | gimmu : Immunizations | gpol : Domestic Politics | gout : Outbreaks/Epidemics | gcat : Political/General News | gcold : Respiratory Tract Diseases | ghea : Health | gmed : Medical Conditions | gpir : Politics/International Relations | gspox : Infectious Diseases | gtrea : Medical Treatments/Procedures,usa : United States | namz : North America,,Foreign Desk,The New York Times Company,Document NYTF000020210505eh550003f
