nid,id,hd,cr,wc,pd,et,sn,sc,ed,pg,la,cy,lp,td,ct,rf,co,ina,ns,re,ipc,ipd,pub,an
515,Factiva-20210602-1526,"Lessons From a Man Who Pioneered Masks
   BY
By Wudan Yan",,"1,677 words",25 May 2021,,The New York Times,NYTF,Late Edition - Final,8,English,Copyright 2021 The New York Times Company.  All Rights Reserved.,"In late 1910, a deadly plague started spreading in the northeast regions of China, reaching the large city of Harbin. Tens of thousands of people coughed up blood; their skin pruned and turned purple. They all died.

This outbreak sent the Qing government into a tailspin: They didn't know what illness was causing these deaths, let alone how to control it. So they brought in one of the best trained doctors in Asia at the time, Dr. Wu Lien-Teh. After performing autopsies, Dr. Wu found Yersinia pestis, a bacterium similar to the one that had caused bubonic plague in the West. He recognized Manchuria's plague as a respiratory disease and urged everyone, especially health care professionals and law enforcement, to wear masks.",,,,,,gout : Outbreaks/Epidemics | gglobe : Global/World Issues | gsars : Novel Coronaviruses | gsci : Sciences/Humanities | gcat : Political/General News | gcold : Respiratory Tract Diseases | ghea : Health | gmed : Medical Conditions | gspox : Infectious Diseases,china : China | easiaz : Eastern Asia | chinaz : Greater China | heilon : Heilongjiang | usa : United States | apacz : Asia Pacific | asiaz : Asia | bric : BRICS Countries | devgcoz : Emerging Market Countries | dvpcoz : Developing Economies | namz : North America,,Science Desk,The New York Times Company,Document NYTF000020210525eh5p0002z
516,Factiva-20210602-1526,"Business News: Businesses Split on Mask Rules --- As guidance shifts, enforcement has become more difficult for small companies
   BY
By Julie Wernau",,804 words,25 May 2021,,The Wall Street Journal,J,,B3,English,"Copyright 2021 Dow Jones & Company, Inc. All Rights Reserved.","SANDUSKY, Ohio -- When the CDC said it was safe for fully vaccinated people to stop wearing face masks, Angela Warren quietly changed the sign at the gym she co-owns, from ""masks are mandated"" to ""masks are recommended.""

The clients at her gym look a lot like the city of Sandusky. Some can't be bothered with masks or Covid-19 at all. Many are vaccinated. Others say they never will be. ""Don't judge,"" she tells people.",,,,uscdcp : Centers for Disease Control and Prevention,,gsars : Novel Coronaviruses | gout : Outbreaks/Epidemics | nmajev : Major News Events | ntop : Top Wire News | gcat : Political/General News | gcold : Respiratory Tract Diseases | ghea : Health | gmed : Medical Conditions | gspox : Infectious Diseases | ndj : Dow Jones Top Stories | redit : Selection of Top Stories/Trends/Analysis,usoh : Ohio | usa : United States | namz : North America | usc : Midwest U.S.,HHS | USG | NND | BAF,,"Dow Jones & Company, Inc.",Document J000000020210525eh5p0000r
517,Factiva-20210602-1526,"Restaurant workers are moving on
   BY
Eli Rosenberg",,"2,061 words",25 May 2021,,The Washington Post,WP,FINAL,A17,English,"Copyright 2021, The Washington Post Co. All Rights Reserved","Jim Conway started working in restaurants in 1982, making $2.13 an hour, plus tips.

And though the world has changed significantly in the nearly 40 years since then, his hourly wage has not. At the Olive Garden outside of Pittsburgh where he worked when the pandemic hit last year, he was making $2.83 an hour, the minimum wage for tipped workers in Pennsylvania, plus tips.",,,,,i6611 : Full-service Restaurants | i66 : Lodgings/Restaurants/Bars | ilea : Leisure/Arts/Hospitality | i661 : Restaurants/Cafes/Fast Food Places,c42 : Labor/Personnel | cwrkpa : Workers Pay | reqlea : Suggested Reading   Leisure/Arts | reqrhr : Suggested Reading   Hotels/Restaurants/Casinos | ccat : Corporate/Industrial News | ncat : Content Types | nfact : Factiva Filters | nfcpin : C&E Industry News Filter | redit : Selection of Top Stories/Trends/Analysis | reqr : Suggested Reading   Industry News,usa : United States | usfl : Florida | namz : North America | uss : Southern U.S.,,National-Economy,Washington Post,Document WP00000020210525eh5p0000r
518,Factiva-20210602-1526,The News Quiz,,525 words,24 May 2021,,The New York Times,NYTF,Late Edition - Final,2,English,Copyright 2021 The New York Times Company.  All Rights Reserved.,"1. After changing its guidance recently, the Centers for Disease Control and Prevention now recommends mask-wearing in which three of the following situations:

a. In hospitals and nursing homes, regardless of your vaccination status",,,,,,gcat : Political/General News | ncolu : Columns | ncat : Content Types,usa : United States | china : China | usny : New York State | apacz : Asia Pacific | asiaz : Asia | bric : BRICS Countries | chinaz : Greater China | devgcoz : Emerging Market Countries | dvpcoz : Developing Economies | easiaz : Eastern Asia | namz : North America | use : Northeast U.S.,,Metropolitan Desk,The New York Times Company,Document NYTF000020210524eh5o0004i
519,Factiva-20210602-1526,"Vaccinate Your Teenager to Protect My 4-Year-Old
   BY
By Wajahat Ali",,"1,045 words",24 May 2021,,The New York Times,NYTF,Late Edition - Final,23,English,Copyright 2021 The New York Times Company.  All Rights Reserved.,"You and your kids could help protect my 4-year-old daughter's life.

Nusayba was found to have a rare cancer at the age of 2. Since then, she has endured multiple rounds of chemotherapy and a liver transplant. Fortunately, she has been cancer-free for over a year now. Her cheeks have filled out, her bouncy, thick curls are growing back, and we can't help indulging her love of cinnamon rolls and Dippin' Dots.",,,,dipdot : Dippin  Dots LLC | jxoxsm : Fischer Enterprises LLC,i41 : Food/Beverages | i413 : Dairy Products | i4132 : Ice Cream/Frozen Desserts | i414 : Preserved Foods | i4141 : Frozen Food | icnp : Consumer Goods | ifood : Food Products,gsars : Novel Coronaviruses | gcancr : Cancer | gparen : Parenting/Parenthood | grelad : Relationships | gimmu : Immunizations | ncolu : Columns | nedc : Commentaries/Opinions | nedi : Editorials | gcat : Political/General News | gcold : Respiratory Tract Diseases | ghea : Health | glife : Living/Lifestyle | gmed : Medical Conditions | gspox : Infectious Diseases | gtrea : Medical Treatments/Procedures | ncat : Content Types | nfact : Factiva Filters | nfcpex : C&E Executive News Filter,usa : United States | namz : North America,,Editorial Desk | Op-Ed,The New York Times Company,Document NYTF000020210524eh5o00037
520,Factiva-20210602-1526,"With many vaccinated, businesses face dilemma: AROUND GEORGIA A RECAP
   BY
Helena Oliviero | helena.oliviero@ajc.com",Staff,763 words,23 May 2021,,The Atlanta Journal - Constitution,ATJC,Main,A2,English,"Copyright (c) 2021 The Atlanta Journal-Constitution, All Rights Reserved","In Georgia, the number of new coronavirus infections continues to fall. And the number of vaccinated people continues to rise —hough at a slower pace than last month.

Close to half of adults in the state have received at least one dose of a vaccine, according to the Centers for Disease Control and Prevention.",,,,uscdcp : Centers for Disease Control and Prevention,i2572 : Vaccines | i6483 : Decorating/DIY/Hardware Stores | i257 : Pharmaceuticals | i951 : Healthcare/Life Sciences | i64 : Retail/Wholesale | i648 : Household Goods/Hardware Stores | i654 : Specialty Retailing | idrugty : Specialized Drugs/Medications | iretail : Retail,gsars : Novel Coronaviruses | gout : Outbreaks/Epidemics | gimmu : Immunizations | reqrhc : Suggested Reading   Healthcare | reqrph : Suggested Reading   Pharmaceuticals | gcat : Political/General News | gcold : Respiratory Tract Diseases | ghea : Health | gmed : Medical Conditions | gspox : Infectious Diseases | gtrea : Medical Treatments/Procedures | redit : Selection of Top Stories/Trends/Analysis | reqr : Suggested Reading   Industry News,usga : Georgia (US) | atlnt : Atlanta | usa : United States | namz : North America | uss : Southern U.S.,,pagesuite,"Cox Enterprises, Inc., d/b/a The Atlanta Journal-Constitution",Document ATJC000020210523eh5n0008f
521,Factiva-20210602-1526,"The newly woke world of Williamsburg
   BY
Peter Marks",,"1,793 words",23 May 2021,,The Washington Post,WP,FINAL,E01,English,"Copyright 2021, The Washington Post Co. All Rights Reserved","On the streets of Colonial Williamsburg - one of the world's premier living-history museums - Emily James cuts a formidable figure. Portraying Edith Cumbo, a free woman of color who walked these byways in the 18th century, James tries daily to convey to tourists the humiliations and contradictions Cumbo lived with.

""I'm restricted,"" she explains to a group of mask-wearing visitors on a walking tour one late-April morning. ""Because the laws didn't say 'free' or 'enslaved.' They said 'Negroes.' """,,,,,,ghist : History | gfrcl : Forced Labor | gcat : Political/General News | gcom : Society/Community | ghum : Human Rights/Civil Liberties | gsci : Sciences/Humanities,usa : United States | namz : North America,,Style,Washington Post,Document WP00000020210523eh5n0002t
522,Factiva-20210602-1526,"My pandemic panic attacks helped me understand people's mask anxieties
   BY
Marin Cogan",,"1,269 words",23 May 2021,,The Washington Post,WP,FINAL,B04,English,"Copyright 2021, The Washington Post Co. All Rights Reserved","A few weeks ago, I was walking with my husband in our D.C. neighborhood when a man approached from the opposite direction on a narrow sidewalk. It had been a few days since the Centers for Disease Control and Prevention announced that vaccinated people could walk outside without masks - a decision I welcomed. My two-week post-vaccination window had just ended, but I'd long felt safe outdoors, based on what I'd read about the low probability of outdoor coronavirus transmission. I'd kept wearing a mask outside as a social courtesy to my neighbors, who were still keeping them up whenever they left the house. But when the CDC changed its guidelines, I decided I'd stop wearing one while exercising outdoors.",,,,uscdcp : Centers for Disease Control and Prevention,,gcat : Political/General News | gfitn : Physical Fitness | gout : Outbreaks/Epidemics | nedc : Commentaries/Opinions | gsars : Novel Coronaviruses | gcold : Respiratory Tract Diseases | ghea : Health | glife : Living/Lifestyle | gmed : Medical Conditions | gspox : Infectious Diseases | ncat : Content Types | nfact : Factiva Filters | nfcpex : C&E Executive News Filter,usa : United States | namz : North America,,Outlook,Washington Post,Document WP00000020210523eh5n0001b
523,Factiva-20210602-1526,"Parents of kids too young to get vaccinated worry about dropping mask mandates too soon
   BY
BY MICHELE MUNZ, St. Louis Post-Dispatch",,"1,436 words",22 May 2021,,St. Louis Post-Dispatch,SLMO,Final,A1,English,"Copyright 2021, St. Louis Post-Dispatch.  All Rights Reserved.","ST. LOUIS —enny Berla has three children, 5-year-old twins and an 8-year-old. And they are really sick of nature hikes, she said.

But, after Berla, her Type 1 diabetic husband and their elderly parents were vaccinated against COVID-19, she looked forward to doing more things with her kids this summer, such as visiting museums, taking theater classes and going on float trips.",,,,,,gsars : Novel Coronaviruses | gout : Outbreaks/Epidemics | gparen : Parenting/Parenthood | glife : Living/Lifestyle | gdias : Diabetes | gimmu : Immunizations | npag : Page One Stories | gcat : Political/General News | gcold : Respiratory Tract Diseases | ghea : Health | gmed : Medical Conditions | gspox : Infectious Diseases | gtrea : Medical Treatments/Procedures | ncat : Content Types,usa : United States | usmo : Missouri | namz : North America | usc : Midwest U.S.,,local-government | vaccinations and immunizations | novel coronavirus pandemic | local-coronavirus | covid-vaccine | missouri vaccination rates | mask mandates | cdc mask recommendation | k-12 education | unvaccinated | parenting | public-health,St. Louis Post-Dispatch,Document SLMO000020210522eh5m007c1
524,Factiva-20210602-1526,"Asking about vaccinations doesn't violate HIPAA
   BY
Devon Link",,599 words,21 May 2021,,USA Today,USAT,,"D.1
   VOL
ISSN:07347456",English,©021 USA Today.  Provided by ProQuest Information and Learning.   All Rights Reserved.,"As mask-wearing and social distancing guidelines relax for fully vaccinated people, businesses are navigating how to implement new policies in their stores. Many businesses are ending mask requirements only for fully vaccinated customers.

Vaccine opponents, including Rep. Marjorie Taylor Greene, R-Ga., are using the occasion to resurrect the false claim that the HIPAA federal privacy law protects individuals from being asked about their vaccination status.",,,,,i82 : Insurance | i82002 : Life Insurance | i8200301 : Health/Medical Insurance | i82003 : Non-life Insurance | ifinal : Financial Services,c11 : Corporate Strategy/Planning | ccat : Corporate/Industrial News | ghea : Health | gimmu : Immunizations | npag : Page One Stories | gcat : Political/General News | gtrea : Medical Treatments/Procedures | ncat : Content Types,usa : United States | namz : North America,,"Newspapers | USA Today, a division of Gannett Satellite Information Network, Inc. | News",USA Today Information Network,Document USAT000020210521eh5l00008
525,Factiva-20210602-1526,"Pandemic comfort food splurges continue
   BY
Patricia Talorico",,807 words,21 May 2021,,USA Today,USAT,,"D.4
   VOL
ISSN:07347456",English,©021 USA Today.  Provided by ProQuest Information and Learning.   All Rights Reserved.,"WILMINGTON, Del. –lap. Scrape. Sizzle.

The soundtrack of a busy, bustling kitchen at Goober's Diner is music to the ears of co-owner Tom Hannum.",,,,,,gfod : Food/Drink | gcat : Political/General News | glife : Living/Lifestyle,usa : United States | namz : North America,,"Newspapers | USA Today, a division of Gannett Satellite Information Network, Inc. | News",USA Today Information Network,Document USAT000020210521eh5l0001a
526,Factiva-20210602-1526,CDC chief says mask decisions should be local,,843 words,20 May 2021,,USA Today,USAT,,"D.3
   VOL
ISSN:07347456",English,©021 USA Today.  Provided by ProQuest Information and Learning.   All Rights Reserved.,"The Centers for Disease Control and Prevention's director, Dr. Rochelle Walensky, testified before the Senate Committee on Appropriations on Wednesday, days after announcing new guidance on masks for fully vaccinated people.

Walensky was asked repeatedly about the guidance and its impact on getting Americans vaccinated. She emphasized that the country is not ""homogenous."" Given the disproportionate rates of vaccination, particularly for people of color who are more at risk, decisions about whether to remove mask mandates must be made at the local level, she said.",,,,uscdcp : Centers for Disease Control and Prevention,,ghea : Health | gcat : Political/General News,usa : United States | ustx : Texas | austin : Austin | jap : Japan | india : India | apacz : Asia Pacific | asiaz : Asia | bric : BRICS Countries | devgcoz : Emerging Market Countries | dvpcoz : Developing Economies | easiaz : Eastern Asia | indsubz : Indian Subcontinent | namz : North America | sasiaz : Southern Asia | uss : Southern U.S.,,"Newspapers | USA Today, a division of Gannett Satellite Information Network, Inc. | News",USA Today Information Network,Document USAT000020210520eh5k00009
527,Factiva-20210602-1526,HIGHLIGHT: Idaho,,"2,282 words",20 May 2021,,USA Today,USAT,,"D.5
   VOL
ISSN:07347456",English,©021 USA Today.  Provided by ProQuest Information and Learning.   All Rights Reserved.,"Alabama Hoover: One of the largest COVID-19 vaccination sites in the state operated for its final day Tuesday as dwindling demand forced a shutdown despite the fact that only about 25% of the state's population is fully vaccinated. Traffic at the drive-up clinic at Hoover Metropolitan Stadium had slowed to a trickle.

Alaska Juneau: A recent increase in people giving up pets to the Juneau Animal Rescue has shelter managers concerned that people going back to their workplaces as coronavirus pandemic restrictions ease can no longer care for the pets they adopted.",,,,,,gsars : Novel Coronaviruses | gout : Outbreaks/Epidemics | gimmu : Immunizations | genv : Natural Environment | gcat : Political/General News | gcold : Respiratory Tract Diseases | ghea : Health | gmed : Medical Conditions | gspox : Infectious Diseases | gtrea : Medical Treatments/Procedures,usa : United States | uss : Southern U.S. | ushi : Hawaii | usak : Alaska | usal : Alabama | usfl : Florida | usid : Idaho | usil : Illinois | usks : Kansas | usmd : Maryland | usne : Nebraska | usnv : Nevada | namz : North America | usc : Midwest U.S. | usw : Western U.S.,,"Newspapers | USA Today, a division of Gannett Satellite Information Network, Inc. | News",USA Today Information Network,Document USAT000020210520eh5k00012
528,Factiva-20210602-1526,"COVID vaccines won't turn the common cold or flu 'extremely lethal'
   BY
Miriam Fauzia",,967 words,20 May 2021,,USA Today,USAT,,"D.3
   VOL
ISSN:07347456",English,©021 USA Today.  Provided by ProQuest Information and Learning.   All Rights Reserved.,"While COVID-19 has been raging on for more than a year, there's one viral illness the U.S. has not seen much of: the flu.

Flu activity has been at a record low, with deaths, cases and hospitalizations far lower than in previous years, according to the U.S. Centers for Disease Control and Prevention.",,,,,i257 : Pharmaceuticals | i951 : Healthcare/Life Sciences,gsars : Novel Coronaviruses | gout : Outbreaks/Epidemics | gcold : Respiratory Tract Diseases | gimmu : Immunizations | gmed : Medical Conditions | reqrhc : Suggested Reading   Healthcare | reqrph : Suggested Reading   Pharmaceuticals | gcat : Political/General News | ghea : Health | gspox : Infectious Diseases | gtrea : Medical Treatments/Procedures | redit : Selection of Top Stories/Trends/Analysis | reqr : Suggested Reading   Industry News,usa : United States | namz : North America,,"Newspapers | USA Today, a division of Gannett Satellite Information Network, Inc. | News",USA Today Information Network,Document USAT000020210520eh5k0000m
529,Factiva-20210602-1526,"Families Spend Big on Elaborate Reunions as Restrictions Fade
   BY
By Debra Kamin",,"1,877 words",20 May 2021,,The New York Times,NYTF,Late Edition - Final,6,English,Copyright 2021 The New York Times Company.  All Rights Reserved.,"Newly vaccinated families are opting for private jets, luxury resorts and guided tours in elaborate new twists on the old-fashioned family reunion.

Jeff Belcher, 41, wouldn't necessarily have chosen Williamsburg, Va., as the destination for his family's first vacation since travel restrictions began to ease. But when his extended family decided to travel to the American Revolution-era town for a reunion this summer, he knew that he, his wife and their three children wouldn't miss it.",,,,,,glife : Living/Lifestyle | gtour : Travel | gcat : Political/General News,usa : United States | namz : North America,,Business/Financial Desk,The New York Times Company,Document NYTF000020210520eh5k0003z
530,Factiva-20210602-1526,"Editorial: CDC's mask guidance for the fully vaccinated doesn't mean a return to normal
   BY
By the Editorial Board",,552 words,19 May 2021,,St. Louis Post-Dispatch,SLMO,Final,A8,English,"Copyright 2021, St. Louis Post-Dispatch.  All Rights Reserved.","The great mask debate appears to be over, even if the pandemic isn’. The unexpected ferocity of passions over the wearing of —r refusal to wear —asks in public produced countless tense, even violent confrontations over the past 14 months as the quest to save lives devolved bizarrely into political football. Against that backdrop, new guidance from the Centers for Disease Control and Prevention says vaccinated Americans no longer need to wear a mask in most settings.

Local governments and big chain stores quickly dropped their mask requirements. Now a new question arises: Did the CDC drop its mask recommendations too soon?",,,,uscdcp : Centers for Disease Control and Prevention,,gvbod : Government Bodies | gimmu : Immunizations | gpol : Domestic Politics | greg : Regional Politics | nedi : Editorials | gcat : Political/General News | ghea : Health | gpir : Politics/International Relations | gtrea : Medical Treatments/Procedures | ncat : Content Types,usa : United States | usmo : Missouri | namz : North America | usc : Midwest U.S.,,commentary | local-coronavirus | centers for disease control and prevention | mask mandates,St. Louis Post-Dispatch,Document SLMO000020210520eh5j00234
531,Factiva-20210602-1526,"Mask up? Well, maybe
   BY
Kelly Tyko",,896 words,19 May 2021,,USA Today,USAT,,"A.1
   VOL
ISSN:07347456",English,©021 USA Today.  Provided by ProQuest Information and Learning.   All Rights Reserved.,"The Centers for Disease Control and Prevention may say fully vaccinated Americans no longer need to wear face masks, but the mask conflict at stores isn't going away.

As vaccinated Americans begin to take off their masks and retailers update their masking policies, the debates and outbursts related to mask wearing (or lack thereof) are expected to continue, experts told USA TODAY.",,,,uscdcp : Centers for Disease Control and Prevention,i64 : Retail/Wholesale | i654 : Specialty Retailing | i656 : Mixed Retailing | iretail : Retail,ccat : Corporate/Industrial News | ghea : Health | gimmu : Immunizations | gmed : Medical Conditions | gout : Outbreaks/Epidemics | gsars : Novel Coronaviruses | npag : Page One Stories | gcat : Political/General News | gcold : Respiratory Tract Diseases | gspox : Infectious Diseases | gtrea : Medical Treatments/Procedures | ncat : Content Types,usa : United States | namz : North America,,"Newspapers | USA Today, a division of Gannett Satellite Information Network, Inc. | News",USA Today Information Network,Document USAT000020210519eh5j00030
532,Factiva-20210602-1526,"Home Depot revenue, profits get another boost from pandemic: Retailer continues to benefit from boom in home improvement.
   BY
Michael E. Kanell",Staff,401 words,19 May 2021,,The Atlanta Journal - Constitution,ATJC,Main,A2,English,"Copyright (c) 2021 The Atlanta Journal-Constitution, All Rights Reserved","EARNINGS&

Home Depot on Tuesday reported sales of $37.5 billion for its fiscal first quarter, up nearly one-third from a year earlier, as the giant retailer blew past analysts’xpectations.",,,,"homd : The Home Depot, Inc.",i6483 : Decorating/DIY/Hardware Stores | i64 : Retail/Wholesale | i648 : Household Goods/Hardware Stores | i654 : Specialty Retailing | iretail : Retail,c151 : Earnings | gout : Outbreaks/Epidemics | c1513 : Sales Figures | c15 : Financial Performance | ccat : Corporate/Industrial News | gcat : Political/General News | ghea : Health | gmed : Medical Conditions | gspox : Infectious Diseases | ncat : Content Types | nfact : Factiva Filters | nfcpin : C&E Industry News Filter,usga : Georgia (US) | namz : North America | usa : United States | uss : Southern U.S.,,pagesuite,"Cox Enterprises, Inc., d/b/a The Atlanta Journal-Constitution",Document ATJC000020210519eh5j0008g
533,Factiva-20210602-1526,"Faces of White House sometimes remain masked
   BY
Annie Linskey",,"1,213 words",19 May 2021,,The Washington Post,WP,FINAL,A01,English,"Copyright 2021, The Washington Post Co. All Rights Reserved","A maskless President Biden delivered triumphant remarks Thursday, heralding the news that federal health guidelines had changed to say fully vaccinated Americans need not wear masks indoors or outside in most situations.

Then he went home to Wilmington, Del., where a state mask mandate remained in place. Biden was seen walking out of church with his black mask still firmly fixed to his face. He had it on again Tuesday morning as he emerged from his presidential limousine. Vice President Harris also appeared maskless for the Thursday announcement but wore one over the weekend when she dropped by Washington's Eastern Market.",,,,,,npag : Page One Stories | ncat : Content Types,usa : United States | usdc : Washington DC | namz : North America | uss : Southern U.S.,,National-Politics,Washington Post,Document WP00000020210519eh5j0000f
534,Factiva-20210602-1526,"At Ford plant, Biden feels a need for speed while promoting clean-energy tech
   BY
Matt Viser",,"1,168 words",19 May 2021,,The Washington Post,WP,FINAL,A18,English,"Copyright 2021, The Washington Post Co. All Rights Reserved","When President Biden on Tuesday took the stage at a Ford plant he said, ""I'm a car guy."" And then, shortly afterward, he proved it.

Biden - in an excursion that probably made his Secret Service detail squirm - jumped into a new F-150 Lightning electric truck and pressed the accelerator, zipping around an empty lot.",,,,,,gcar : Cars | gmetha : Methamphetamine Use/Abuse | gabus : Drug/Substance Use/Abuse | gcat : Political/General News | gcom : Society/Community | glife : Living/Lifestyle | gsoc : Social Issues,usa : United States | namz : North America,,National-Politics,Washington Post,Document WP00000020210519eh5j0000b
