nid,id,hd,cr,wc,pd,et,sn,sc,ed,pg,la,cy,lp,td,ct,rf,co,ina,ns,re,ipc,ipd,pub,an
1,Factiva-20210602-1530,,,,,,,,,,,,,,,,,,,,,,,
2,Factiva-20210602-1530,"Gather in Public (With Care)
   BY
By Robin Lloyd",,"1,634 words",30 May 2021,,The New York Times,NYTF,Late Edition - Final,15,English,Copyright 2021 The New York Times Company.  All Rights Reserved.,"Going to Disney World this summer? Or to your niece's sixth birthday party? Here's how to do it safely.

During spring break last month, Monica Gandhi tested her confidence in coronavirus science. She and her two unvaccinated children stood in a packed crowd near a well-known bridge in Austin, Texas, to enjoy watching the emergence at dusk of thousands of Brazilian free-tailed bats.",,,,,,gsars : Novel Coronaviruses | gout : Outbreaks/Epidemics | glife : Living/Lifestyle | gcat : Political/General News | gcold : Respiratory Tract Diseases | ghea : Health | gmed : Medical Conditions | gspox : Infectious Diseases,usa : United States | namz : North America,,House & Home/Style Desk,The New York Times Company,Document NYTF000020210530eh5u0004c
3,Factiva-20210602-1530,"The unseen coronavirus risk for unvaccinated people
   BY
Dan Keating                Leslie Shapiro",,"1,136 words",30 May 2021,,The Washington Post,WP,FINAL,A15,English,"Copyright 2021, The Washington Post Co. All Rights Reserved","The country's declining covid-19 case rates present an unrealistically optimistic perspective for half of the nation - the half that is still not vaccinated. As more people receive vaccine shots, covid-19 cases are occurring mostly in the increasingly narrow slice of the unprotected population. So The Washington Post adjusted its case, death and hospitalization rates to account for that - and found that in some places, the virus continues to rage among those who haven't received a shot. The rosy national figures showing declining case numbers led the Centers for Disease Control and Prevention to loosen mask recommendations and President Biden to advise people to take off their masks and smile. But adjustments for vaccinations show the rate among susceptible, unvaccinated people is 69 percent higher than the standard figures being publicized. With that adjustment, the national death rate is roughly the same as it was two months ago and is barely inching down.",,,,,,gsars : Novel Coronaviruses | gout : Outbreaks/Epidemics | gimmu : Immunizations | gcat : Political/General News | gcold : Respiratory Tract Diseases | ghea : Health | gmed : Medical Conditions | gspox : Infectious Diseases | gtrea : Medical Treatments/Procedures,usa : United States | use : Northeast U.S. | uswa : Washington State | namz : North America | usw : Western U.S.,,Health-Environment-Science,Washington Post,Document WP00000020210530eh5u0001l
4,Factiva-20210602-1530,"Surge in Fliers to Test Airports and Carriers
   BY
By Doug Cameron",,836 words,29 May 2021,,The Wall Street Journal,J,,A1,English,"Copyright 2021 Dow Jones & Company, Inc. All Rights Reserved.","U.S. airline-passenger numbers are forecast to average as many as two million a day through the Memorial Day holiday, testing the ability of airlines and airports to handle infrequent and, in some cases, unruly, fliers.

While domestic air-travel numbers last Christmas were half those in 2019, recent Transportation Security Administration counts have them now hovering around 90% of pre-pandemic levels. The TSA screened 1.9 million passengers last Sunday, a 14-month high.",,,,amair : American Airlines Group Inc. | ustsa : Transportation Security Administration,i764 : Airports | i7501 : Passenger Airlines | i75 : Airlines | iairtr : Air Transport | itsp : Transportation/Logistics,gtour : Travel | gtrans : Transport | nmajev : Major News Events | npag : Page One Stories | ntop : Top Wire News | gcat : Political/General News | glife : Living/Lifestyle | ncat : Content Types | ndj : Dow Jones Top Stories | redit : Selection of Top Stories/Trends/Analysis,usa : United States | namz : North America,FAA | HLS | USG | NND | TRSH | PGO,,"Dow Jones & Company, Inc.",Document J000000020210529eh5t0002o
5,Factiva-20210602-1530,"U.S. News: Covid-19 Shot Can Be a Job Requirement --- Updated guidance from EEOC notes some exceptions; incentives are allowed
   BY
By Eric Morath and Sarah Chaney Cambon",,540 words,29 May 2021,,The Wall Street Journal,J,,A3,English,"Copyright 2021 Dow Jones & Company, Inc. All Rights Reserved.","U.S. employers could require all workers physically entering a workplace to be vaccinated against Covid-19, the federal government said Friday.

The Equal Employment Opportunity Commission issued updated guidance stating that federal laws don't prevent an employer from requiring workers to be vaccinated.",,,,equoc : United States Equal Employment Opportunity Commission,i257 : Pharmaceuticals | i951 : Healthcare/Life Sciences,gvbod : Government Bodies | gjob : General Labor Issues | gsars : Novel Coronaviruses | gout : Outbreaks/Epidemics | ghea : Health | gimmu : Immunizations | gpol : Domestic Politics | nmajev : Major News Events | ntop : Top Wire News | gcat : Political/General News | gcold : Respiratory Tract Diseases | gmed : Medical Conditions | gpir : Politics/International Relations | gspox : Infectious Diseases | gtrea : Medical Treatments/Procedures | ndj : Dow Jones Top Stories | redit : Selection of Top Stories/Trends/Analysis,usa : United States | namz : North America,FDL | USG | NND | USN,,"Dow Jones & Company, Inc.",Document J000000020210529eh5t0002j
6,Factiva-20210602-1530,"OFF DUTY --- The Looking Forward Issue: Eating & Drinking: Return To the Table --- We've all gone a little feral over the last year. A dinner party provides an ideal opportunity to reconnect with our civilized selves. Here's how to actually enjoy it.
   BY
By Rico Gagliano and Brendan Francis Newnam",,"2,741 words",29 May 2021,,The Wall Street Journal,J,,D1,English,"Copyright 2021 Dow Jones & Company, Inc. All Rights Reserved.","Back in 2018, we wrote a book called ""Brunch Is Hell,"" in which we declared the dinner party the cornerstone of civilization -- and brunch its evil antithesis.

Unlike brunchers at a restaurant, we noted, dinner party hosts selflessly welcome friends and strangers into their homes, provide them with free food and in return ask only that no one spill wine on the Pomeranian. A dinner party, we said, is a safe space for the freewheeling exchange of ideas, where differences can be loudly debated and impromptu dancing is welcomed.",,,,,,gbook : Books | gfod : Food/Drink | glife : Living/Lifestyle | grcps : Recipes | ncat : Content Types | nmajev : Major News Events | ntop : Top Wire News | gcat : Political/General News | gent : Arts/Entertainment | ndj : Dow Jones Top Stories | nfact : Factiva Filters | nfce : C&E Exclusion Filter | nrgn : Routine General News | redit : Selection of Top Stories/Trends/Analysis,usa : United States | namz : North America,MMR | NND | OFD,,"Dow Jones & Company, Inc.",Document J000000020210529eh5t0000j
7,Factiva-20210602-1530,"Coronavirus test options plentiful as demand falls
   BY
Ken Alltucker",,"1,753 words",28 May 2021,,USA Today,USAT,,"A.1
   VOL
ISSN:07347456",English,©021 USA Today.  Provided by ProQuest Information and Learning.   All Rights Reserved.,"In Chattanooga, Tennessee, health workers are handing out thousands of rapid coronavirus tests at clinics, churches, restaurants and grocers.

It's part of a big experiment to gauge whether flooding a community with rapid coronavirus tests can spur a meaningful reduction in cases and COVID-19 hospitalizations. Researchers want to know: If people have free home tests, will they check their status and isolate if infected?",,,,,,gsars : Novel Coronaviruses | gout : Outbreaks/Epidemics | c23 : Research/Development | ghea : Health | gimmu : Immunizations | npag : Page One Stories | ccat : Corporate/Industrial News | gcat : Political/General News | gcold : Respiratory Tract Diseases | gmed : Medical Conditions | gspox : Infectious Diseases | gtrea : Medical Treatments/Procedures | ncat : Content Types,usa : United States | ustn : Tennessee | usnc : North Carolina | namz : North America | uss : Southern U.S.,,"Newspapers | USA Today, a division of Gannett Satellite Information Network, Inc. | News",USA Today Information Network,Document USAT000020210528eh5s0002u
8,Factiva-20210602-1530,"Glitches Mar Virus Apps That Warn Of Exposure
   BY
By Natasha Singer",,"1,580 words",28 May 2021,,The New York Times,NYTF,Late Edition - Final,1,English,Copyright 2021 The New York Times Company.  All Rights Reserved.,"Sarah Cavey, a real estate agent in Denver, was thrilled last fall when Colorado introduced an app to warn people of possible coronavirus exposures.

Based on software from Apple and Google, the state's smartphone app uses Bluetooth signals to detect users who come into close contact. If a user later tests positive, the person can anonymously notify other app users whom the person may have crossed paths with in restaurants, on trains or elsewhere.",,,,gognew : Google LLC | goog : Alphabet Inc.,imobsoft : Mobile Applications Software | i3302 : Computers/Consumer Electronics | icellph : Cell/Mobile/Smart Phones | i330202 : Software | i3302021 : Applications Software | i3441 : Telecommunications Equipment | i34411 : Mobile Communications Devices | i3454 : Personal Electronics | icomp : Computing | ielec : Consumer Electronics | ihandaps : Handheld Electronic Devices | itech : Technology | i8395464 : Internet Search Engines | iint : Online Service Providers,ghack : Cybercrime/Hacking | gcvir : Malware | gvhhs : Health/Social Services Department | gsars : Novel Coronaviruses | gcat : Political/General News | gcold : Respiratory Tract Diseases | gcrim : Crime/Legal Action | ghea : Health | gmed : Medical Conditions | gpir : Politics/International Relations | gpol : Domestic Politics | gspox : Infectious Diseases | gvbod : Government Bodies | gvexe : Executive Branch | ncat : Content Types | nfact : Factiva Filters | nfcpex : C&E Executive News Filter,usa : United States | usco : Colorado | namz : North America | usw : Western U.S.,,Business/Financial Desk,The New York Times Company,Document NYTF000020210528eh5s0007p
9,Factiva-20210602-1530,Republican Actions Against Democracy,,915 words,28 May 2021,,The New York Times,NYTF,Late Edition - Final,18,English,Copyright 2021 The New York Times Company.  All Rights Reserved.,"To the Editor:

Re ''G.O.P. Voting Bills Ratchet Up the Penalties on Poll Workers'' (front page, May 16):",,,,,,gpol : Domestic Politics | gcat : Political/General News | nlet : Letters | gpir : Politics/International Relations | ncat : Content Types | nfact : Factiva Filters | nfce : C&E Exclusion Filter | niwe : IWE Filter | nrgn : Routine General News,usa : United States | namz : North America,,Editorial Desk | Letter,The New York Times Company,Document NYTF000020210528eh5s00061
10,Factiva-20210602-1530,How to Allocate Vaccines Fairly: Covax's View,,328 words,28 May 2021,,The New York Times,NYTF,Late Edition - Final,18,English,Copyright 2021 The New York Times Company.  All Rights Reserved.,"Summary summary summary

To the Editor:",,,,,i257 : Pharmaceuticals | i951 : Healthcare/Life Sciences,gimmu : Immunizations | nlet : Letters | gcat : Political/General News | ghea : Health | gtrea : Medical Treatments/Procedures | ncat : Content Types | nfact : Factiva Filters | nfce : C&E Exclusion Filter | niwe : IWE Filter | nrgn : Routine General News,usa : United States | namz : North America,,Editorial Desk | Letter,The New York Times Company,Document NYTF000020210528eh5s0005y
11,Factiva-20210602-1530,"Lab-leak theory jumbles politics of the pandemic
   BY
Annie Linskey                Shane Harris                David Willman",,"1,720 words",28 May 2021,,The Washington Post,WP,FINAL,A01,English,"Copyright 2021, The Washington Post Co. All Rights Reserved","Senate Democrats lined up alongside Sen. Josh Hawley (Mo.), one of their least-favorite Republicans, to support a measure urging the Biden administration to declassify intelligence on whether the novel coronavirus originated in a Chinese lab. A Democratic-led House subcommittee is pledging an investigation into the virus's origins, including the lab's safety record.

And President Biden, in an unusual public statement, directed U.S. intelligence agencies to ""redouble their efforts"" to determine the cause of the pandemic, suggesting that while the virus could have jumped from animals to humans, it also could have escaped from the lab.",,,,,,gcat : Political/General News | gpol : Domestic Politics | gsars : Novel Coronaviruses | gout : Outbreaks/Epidemics | gspy : Espionage | npag : Page One Stories | gcns : National/Public Security | gcold : Respiratory Tract Diseases | ghea : Health | gmed : Medical Conditions | gpir : Politics/International Relations | gspox : Infectious Diseases | ncat : Content Types,china : China | usdc : Washington DC | apacz : Asia Pacific | asiaz : Asia | bric : BRICS Countries | chinaz : Greater China | devgcoz : Emerging Market Countries | dvpcoz : Developing Economies | easiaz : Eastern Asia | namz : North America | usa : United States | uss : Southern U.S.,,National-Politics,Washington Post,Document WP00000020210528eh5s0000w
12,Factiva-20210602-1530,"This agency veteran best to run ATF, Democrats say
   BY
Paul Kane",,"1,280 words",27 May 2021,,The Washington Post,WP,FINAL,A02,English,"Copyright 2021, The Washington Post Co. All Rights Reserved","Soon after retiring from a three-decade career in law enforcement, David Chipman used his first op-ed as a private citizen to advocate for an unusual cause: Senate confirmation of the director of the Bureau of Alcohol, Tobacco, Firearms and Explosives.

Since the Senate changed rules to require that the ATF director undergo a confirmation process, no one had been able to get through the gantlet to win a vote to fully take over the agency that regulates firearms.",,,,usscjd : United States Senate Committee on the Judiciary,,gvuph : Upper House | ggunc : Gun Control | gcat : Political/General News | gpol : Domestic Politics | gvcng : Legislative Branch | gcom : Society/Community | gpir : Politics/International Relations | gsoc : Social Issues | gvbod : Government Bodies,usa : United States | namz : North America,,National-Politics,Washington Post,Document WP00000020210527eh5r0002j
13,Factiva-20210602-1530,"Greene slammed for Holocaust remarks
   BY
Ledyard King",,478 words,26 May 2021,,USA Today,USAT,,"D.2
   VOL
ISSN:07347456",English,©021 USA Today.  Provided by ProQuest Information and Learning.   All Rights Reserved.,"WASHINGTON –epublican congressional leaders sharply condemned Rep. Marjorie Taylor Greene on Tuesday for comparing COVID-19 safety protocols such as mask wearing and vaccinations to actions of the Nazi regime, though they have stopped short of calling for any formal discipline.

The Georgia Republican who has frequently warred with Democrats found herself at odds with GOP leaders Tuesday, including Senate Minority Leader Mitch McConnell of Kentucky and GOP House leader Kevin McCarthy of California.",,,,,,gcat : Political/General News | gpol : Domestic Politics | gimmu : Immunizations | gvio : Military Action | gcns : National/Public Security | ghea : Health | gpir : Politics/International Relations | grisk : Risk News | gtrea : Medical Treatments/Procedures,usa : United States | namz : North America,,"Newspapers | USA Today, a division of Gannett Satellite Information Network, Inc. | News",USA Today Information Network,Document USAT000020210526eh5q0000u
14,Factiva-20210602-1530,HIGHLIGHT: New York,,"2,281 words",26 May 2021,,USA Today,USAT,,"D.5
   VOL
ISSN:07347456",English,©021 USA Today.  Provided by ProQuest Information and Learning.   All Rights Reserved.,"Alabama Montgomery: Gov. Kay Ivey on Monday signed legislation banning so-called vaccine passports in an effort to prohibit requiring proof of a COVID-19 vaccination to enter a business, school or event.

Alaska Girdwood: The state's largest ski area ended its winter season over the weekend –he latest it has run in a decade, resort managers say. Alyeska Resort marked the close Sunday by hosting a COVID-19 vaccine clinic and offering a lift ticket as a prize for those who received a shot, Alaska's News Source reports.",,,,,i257 : Pharmaceuticals | i951 : Healthcare/Life Sciences,gsars : Novel Coronaviruses | gout : Outbreaks/Epidemics | gimmu : Immunizations | coccsh : Workplace Safety/Health Issues | greg : Regional Politics | c151 : Earnings | e211 : Government Budget/Taxation | gedu : Education | gschol : Scholarships/Educational Grants | c15 : Financial Performance | c42 : Labor/Personnel | ccat : Corporate/Industrial News | e21 : Government Finance | ecat : Economic News | gcat : Political/General News | gcold : Respiratory Tract Diseases | ghea : Health | gmed : Medical Conditions | gpir : Politics/International Relations | gpol : Domestic Politics | gspox : Infectious Diseases | gtrea : Medical Treatments/Procedures | ncat : Content Types | nfact : Factiva Filters | nfcpin : C&E Industry News Filter,usa : United States | uss : Southern U.S. | usak : Alaska | usal : Alabama | usde : Delaware | usfl : Florida | ushi : Hawaii | usia : Iowa | usla : Louisiana | usmd : Maryland | usmn : Minnesota | usms : Mississippi | usnd : North Dakota | usny : New York State | usok : Oklahoma | namz : North America | usc : Midwest U.S. | use : Northeast U.S. | usw : Western U.S.,,"Newspapers | USA Today, a division of Gannett Satellite Information Network, Inc. | News",USA Today Information Network,Document USAT000020210526eh5q0000t
15,Factiva-20210602-1530,"Lessons From a Man Who Pioneered Masks
   BY
By Wudan Yan",,"1,677 words",25 May 2021,,The New York Times,NYTF,Late Edition - Final,8,English,Copyright 2021 The New York Times Company.  All Rights Reserved.,"In late 1910, a deadly plague started spreading in the northeast regions of China, reaching the large city of Harbin. Tens of thousands of people coughed up blood; their skin pruned and turned purple. They all died.

This outbreak sent the Qing government into a tailspin: They didn't know what illness was causing these deaths, let alone how to control it. So they brought in one of the best trained doctors in Asia at the time, Dr. Wu Lien-Teh. After performing autopsies, Dr. Wu found Yersinia pestis, a bacterium similar to the one that had caused bubonic plague in the West. He recognized Manchuria's plague as a respiratory disease and urged everyone, especially health care professionals and law enforcement, to wear masks.",,,,,,gout : Outbreaks/Epidemics | gglobe : Global/World Issues | gsars : Novel Coronaviruses | gsci : Sciences/Humanities | gcat : Political/General News | gcold : Respiratory Tract Diseases | ghea : Health | gmed : Medical Conditions | gspox : Infectious Diseases,china : China | easiaz : Eastern Asia | chinaz : Greater China | heilon : Heilongjiang | usa : United States | apacz : Asia Pacific | asiaz : Asia | bric : BRICS Countries | devgcoz : Emerging Market Countries | dvpcoz : Developing Economies | namz : North America,,Science Desk,The New York Times Company,Document NYTF000020210525eh5p0002z
16,Factiva-20210602-1530,"Business News: Businesses Split on Mask Rules --- As guidance shifts, enforcement has become more difficult for small companies
   BY
By Julie Wernau",,804 words,25 May 2021,,The Wall Street Journal,J,,B3,English,"Copyright 2021 Dow Jones & Company, Inc. All Rights Reserved.","SANDUSKY, Ohio -- When the CDC said it was safe for fully vaccinated people to stop wearing face masks, Angela Warren quietly changed the sign at the gym she co-owns, from ""masks are mandated"" to ""masks are recommended.""

The clients at her gym look a lot like the city of Sandusky. Some can't be bothered with masks or Covid-19 at all. Many are vaccinated. Others say they never will be. ""Don't judge,"" she tells people.",,,,uscdcp : Centers for Disease Control and Prevention,,gsars : Novel Coronaviruses | gout : Outbreaks/Epidemics | nmajev : Major News Events | ntop : Top Wire News | gcat : Political/General News | gcold : Respiratory Tract Diseases | ghea : Health | gmed : Medical Conditions | gspox : Infectious Diseases | ndj : Dow Jones Top Stories | redit : Selection of Top Stories/Trends/Analysis,usoh : Ohio | usa : United States | namz : North America | usc : Midwest U.S.,HHS | USG | NND | BAF,,"Dow Jones & Company, Inc.",Document J000000020210525eh5p0000r
17,Factiva-20210602-1530,"Restaurant workers are moving on
   BY
Eli Rosenberg",,"2,061 words",25 May 2021,,The Washington Post,WP,FINAL,A17,English,"Copyright 2021, The Washington Post Co. All Rights Reserved","Jim Conway started working in restaurants in 1982, making $2.13 an hour, plus tips.

And though the world has changed significantly in the nearly 40 years since then, his hourly wage has not. At the Olive Garden outside of Pittsburgh where he worked when the pandemic hit last year, he was making $2.83 an hour, the minimum wage for tipped workers in Pennsylvania, plus tips.",,,,,i6611 : Full-service Restaurants | i66 : Lodgings/Restaurants/Bars | ilea : Leisure/Arts/Hospitality | i661 : Restaurants/Cafes/Fast Food Places,c42 : Labor/Personnel | cwrkpa : Workers Pay | reqlea : Suggested Reading   Leisure/Arts | reqrhr : Suggested Reading   Hotels/Restaurants/Casinos | ccat : Corporate/Industrial News | ncat : Content Types | nfact : Factiva Filters | nfcpin : C&E Industry News Filter | redit : Selection of Top Stories/Trends/Analysis | reqr : Suggested Reading   Industry News,usa : United States | usfl : Florida | namz : North America | uss : Southern U.S.,,National-Economy,Washington Post,Document WP00000020210525eh5p0000r
18,Factiva-20210602-1530,The News Quiz,,525 words,24 May 2021,,The New York Times,NYTF,Late Edition - Final,2,English,Copyright 2021 The New York Times Company.  All Rights Reserved.,"1. After changing its guidance recently, the Centers for Disease Control and Prevention now recommends mask-wearing in which three of the following situations:

a. In hospitals and nursing homes, regardless of your vaccination status",,,,,,gcat : Political/General News | ncolu : Columns | ncat : Content Types,usa : United States | china : China | usny : New York State | apacz : Asia Pacific | asiaz : Asia | bric : BRICS Countries | chinaz : Greater China | devgcoz : Emerging Market Countries | dvpcoz : Developing Economies | easiaz : Eastern Asia | namz : North America | use : Northeast U.S.,,Metropolitan Desk,The New York Times Company,Document NYTF000020210524eh5o0004i
19,Factiva-20210602-1530,"Vaccinate Your Teenager to Protect My 4-Year-Old
   BY
By Wajahat Ali",,"1,045 words",24 May 2021,,The New York Times,NYTF,Late Edition - Final,23,English,Copyright 2021 The New York Times Company.  All Rights Reserved.,"You and your kids could help protect my 4-year-old daughter's life.

Nusayba was found to have a rare cancer at the age of 2. Since then, she has endured multiple rounds of chemotherapy and a liver transplant. Fortunately, she has been cancer-free for over a year now. Her cheeks have filled out, her bouncy, thick curls are growing back, and we can't help indulging her love of cinnamon rolls and Dippin' Dots.",,,,dipdot : Dippin  Dots LLC | jxoxsm : Fischer Enterprises LLC,i41 : Food/Beverages | i413 : Dairy Products | i4132 : Ice Cream/Frozen Desserts | i414 : Preserved Foods | i4141 : Frozen Food | icnp : Consumer Goods | ifood : Food Products,gsars : Novel Coronaviruses | gcancr : Cancer | gparen : Parenting/Parenthood | grelad : Relationships | gimmu : Immunizations | ncolu : Columns | nedc : Commentaries/Opinions | nedi : Editorials | gcat : Political/General News | gcold : Respiratory Tract Diseases | ghea : Health | glife : Living/Lifestyle | gmed : Medical Conditions | gspox : Infectious Diseases | gtrea : Medical Treatments/Procedures | ncat : Content Types | nfact : Factiva Filters | nfcpex : C&E Executive News Filter,usa : United States | namz : North America,,Editorial Desk | Op-Ed,The New York Times Company,Document NYTF000020210524eh5o00037
20,Factiva-20210602-1530,"With many vaccinated, businesses face dilemma: AROUND GEORGIA A RECAP
   BY
Helena Oliviero | helena.oliviero@ajc.com",Staff,763 words,23 May 2021,,The Atlanta Journal - Constitution,ATJC,Main,A2,English,"Copyright (c) 2021 The Atlanta Journal-Constitution, All Rights Reserved","In Georgia, the number of new coronavirus infections continues to fall. And the number of vaccinated people continues to rise —hough at a slower pace than last month.

Close to half of adults in the state have received at least one dose of a vaccine, according to the Centers for Disease Control and Prevention.",,,,uscdcp : Centers for Disease Control and Prevention,i2572 : Vaccines | i6483 : Decorating/DIY/Hardware Stores | i257 : Pharmaceuticals | i951 : Healthcare/Life Sciences | i64 : Retail/Wholesale | i648 : Household Goods/Hardware Stores | i654 : Specialty Retailing | idrugty : Specialized Drugs/Medications | iretail : Retail,gsars : Novel Coronaviruses | gout : Outbreaks/Epidemics | gimmu : Immunizations | reqrhc : Suggested Reading   Healthcare | reqrph : Suggested Reading   Pharmaceuticals | gcat : Political/General News | gcold : Respiratory Tract Diseases | ghea : Health | gmed : Medical Conditions | gspox : Infectious Diseases | gtrea : Medical Treatments/Procedures | redit : Selection of Top Stories/Trends/Analysis | reqr : Suggested Reading   Industry News,usga : Georgia (US) | atlnt : Atlanta | usa : United States | namz : North America | uss : Southern U.S.,,pagesuite,"Cox Enterprises, Inc., d/b/a The Atlanta Journal-Constitution",Document ATJC000020210523eh5n0008f
